{
  "schema_versie": "1.2",
  "examen_id": "2008-bibf",
  "vraag_id": "2008-bibf-vrF6",
  "interpretatie_datum": "2026-05-21T00:00:00Z",
  "interpretatie_model": "claude-sonnet-4-6",
  "vraag_herkomst": "officieel",
  "vraag_onderwerp": "Vrijgesteld inkomen: welke is geen vrijgesteld inkomen?",
  "themas": [
    "vrijgesteld inkomen",
    "sociaal voordeel",
    "resultaatgebonden bonus",
    "fietsvergoeding",
    "ziekte-uitkering",
    "personenbelasting"
  ],
  "programmaonderdeel_ids": [
    "2.2"
  ],
  "context_blokken": [],
  "vragen": [
    {
      "id": "a",
      "label_in_pdf": "F6",
      "vraagtype": "mc_keuze",
      "vraagstelling": "Wat is geen vrijgesteld inkomen?",
      "opties": [
        {
          "id": "a",
          "tekst": "Een sociaal voordeel"
        },
        {
          "id": "b",
          "tekst": "Een resultaatgebonden bonus van € 2.000,00"
        },
        {
          "id": "c",
          "tekst": "Een fietsvergoeding van € 0,15/km"
        },
        {
          "id": "d",
          "tekst": "Een wettelijke ziekte-uitkering"
        }
      ],
      "motivatie_verwacht": false,
      "volledigheid": "volledig"
    }
  ],
  "antwoord_hint_in_vraag": null,
  "herinterpretatie_motivering": "Enkelvoudige MC-vraag. Vier opties. Geen correcte-antwoord-aanduiding in de tekst.",
  "kwaliteits_flags": []
}