{
  "schema_versie": "1.2",
  "examen_id": "2024-1",
  "vraag_id": "2024-1-vr1",
  "interpretatie_datum": "2026-05-21T00:00:00Z",
  "interpretatie_model": "claude-opus-4-7",
  "vraag_herkomst": "herinnering",
  "vraag_onderwerp": "Vennootschapsrecht — diverse vragen (BVBA-naar-BV-overgang, quasi-inbreng NV, verlies rechtspersoonlijkheid, statutaire uittreding/uitsluiting)",
  "themas": [
    "vennootschapsrecht",
    "WVV",
    "BVBA",
    "BV",
    "NV",
    "quasi-inbreng",
    "ontbinding",
    "vereffening",
    "uittreding"
  ],
  "programmaonderdeel_ids": [
    "3.0"
  ],
  "context_blokken": [
    {
      "type": "casus_context",
      "tekst": "Onderdeel '1 Vennootschapsrecht' uit het schriftelijk bekwaamheidsexamen ITAA 2024 — herinnerings-fragment met vier deelvragen onder éénzelfde thema."
    }
  ],
  "vragen": [
    {
      "id": "a",
      "label_in_pdf": "A",
      "vraagtype": "open",
      "vraagstelling": "BVBA naar BV volgens nieuw WVV. Aandeelhouder vrij van volstorting van het niet volstort kapitaal. Liquidatietest nodig?",
      "motivatie_verwacht": false,
      "volledigheid": "fragment"
    },
    {
      "id": "b",
      "label_in_pdf": "B",
      "vraagtype": "open",
      "vraagstelling": "Quasi-inbreng in NV. Wie kan dit doen?",
      "motivatie_verwacht": false,
      "volledigheid": "fragment"
    },
    {
      "id": "c",
      "label_in_pdf": "C",
      "vraagtype": "mc_keuze",
      "vraagstelling": "Vennootschap verliest rechtspersoonlijkheid:",
      "opties": [
        {
          "id": "a",
          "tekst": "Bij ontbinding"
        },
        {
          "id": "b",
          "tekst": "Bij publicatie van de ontbinding"
        },
        {
          "id": "c",
          "tekst": "Bij de afsluit van de vereffening"
        },
        {
          "id": "d",
          "tekst": "Bij akkoord van de vennoten"
        }
      ],
      "motivatie_verwacht": false,
      "volledigheid": "volledig"
    },
    {
      "id": "d",
      "label_in_pdf": "D",
      "vraagtype": "mc_keuze",
      "vraagstelling": "Bij welke rechtsvormen kunnen de uittreding/uitsluiting van een aandeelhouder statutair worden geregeld?",
      "opties": [
        {
          "id": "a",
          "tekst": "BV en CV"
        },
        {
          "id": "b",
          "tekst": "Alle behalve NV"
        },
        {
          "id": "c",
          "tekst": "Alle behalve NV en BV"
        },
        {
          "id": "d",
          "tekst": "NV, BV en CV"
        }
      ],
      "motivatie_verwacht": false,
      "volledigheid": "volledig"
    }
  ],
  "antwoord_hint_in_vraag": null,
  "herinterpretatie_motivering": "Herinnering-fragment uit ITAA 2024 schriftelijk examen, onderdeel 'Vennootschapsrecht'. Vier deelvragen onder dit thema: A en B zijn open vragen in trefwoord-vorm (fragment-niveau — exacte vraagstelling onbekend, alleen het topic is bewaard zoals de student het herinnerde). C en D zijn complete MC-vragen met 4 opties elk. Geen modelantwoord aanwezig.",
  "kwaliteits_flags": [
    "subvraag_zonder_inhoud"
  ]
}