{
  "schema_versie": "1.2",
  "examen_id": "2015-1",
  "vraag_id": "2015-1-vr30",
  "interpretatie_datum": "2026-05-21T00:00:00Z",
  "interpretatie_model": "claude-sonnet-4-6",
  "vraag_herkomst": "officieel",
  "vraag_onderwerp": "Aftrekbare bestedingen en belastingverminderingen personenbelasting: onjuiste uitspraak",
  "themas": [
    "belastingverminderingen",
    "aftrekbare bestedingen",
    "kinderoppas",
    "onderhoudsuitkeringen",
    "giften",
    "pensioensparen",
    "dienstencheques",
    "personenbelasting"
  ],
  "programmaonderdeel_ids": [
    "2.2"
  ],
  "context_blokken": [],
  "vragen": [
    {
      "id": "a",
      "label_in_pdf": "–",
      "vraagtype": "mc_keuze",
      "vraagstelling": "Geef aan welke uitspraak ONJUIST is, met betrekking tot de aftrekbare bestedingen en de uitgaven die recht geven op een belastingvermindering.",
      "opties": [
        {
          "id": "a",
          "tekst": "De kosten voor kinderoppas zijn sinds het aanslagjaar 2013 geen aftrekbare bestedingen meer. Die kosten geven sinds het aanslagjaar 2013 daarentegen recht op een belastingvermindering. Indien die belastingvermindering meer bedraagt dan het bedrag van de verschuldigde belasting, wordt het bedrag in meer omgezet in een terugbetaalbaar belastingkrediet."
        },
        {
          "id": "b",
          "tekst": "Wanneer een gemeenschappelijke aanslag wordt gevestigd, worden de onderhoudsuitkeringen die door één echtgenoot persoonlijk verschuldigd zijn, bij voorrang aangerekend op het totale netto-inkomen van die echtgenoot en het eventuele saldo wordt op het totale netto-inkomen van de andere echtgenoot aangerekend."
        },
        {
          "id": "c",
          "tekst": "De door iedere echtgenoot werkelijk gedane giften worden opgeteld en het totaalbedrag ervan geeft recht op een belastingvermindering van 45%. De belastingvermindering wordt evenredig omgedeeld in functie van het belastbare inkomen van elk der echtgenoten ten opzichte van de som van het belastbare inkomen van de beide echtgenoten."
        },
        {
          "id": "d",
          "tekst": "Een belastingplichtige kan voor hetzelfde tijdperk de vermindering voor pensioensparen niet samen verkrijgen met de vermindering voor verwerving van werkgeversaandelen."
        },
        {
          "id": "e",
          "tekst": "Iedere echtgenoot moet het bedrag van zijn betalingen voor de aankoop van dienstencheques vermelden. In geval van een gemeenschappelijke aanslag wordt de belastingvermindering voor dienstencheques evenredig omgedeeld in functie van het belastbaar inkomen van elk der echtgenoten ten opzichte van de som van de belastbare inkomsten van de beide echtgenoten."
        }
      ],
      "motivatie_verwacht": false,
      "volledigheid": "volledig"
    }
  ],
  "antwoord_hint_in_vraag": null,
  "herinterpretatie_motivering": "Vraag 3 van de sectie 'Personenbelasting'. Enkelvoudige MC-vraag met 5 opties, kandidaat identificeert de ONJUISTE uitspraak.",
  "kwaliteits_flags": []
}