{
  "schema_versie": "1.2",
  "examen_id": "2015-1",
  "vraag_id": "2015-1-vr38",
  "interpretatie_datum": "2026-05-21T00:00:00Z",
  "interpretatie_model": "claude-sonnet-4-6",
  "vraag_herkomst": "officieel",
  "vraag_onderwerp": "BTW-verplichting bij eigen verbruik van producten door supermarktuitbater",
  "themas": [
    "btw",
    "eigen verbruik",
    "onttrekking voorraad",
    "maatstaf van heffing",
    "handelaar",
    "btw-verplichting"
  ],
  "programmaonderdeel_ids": [
    "2.4"
  ],
  "context_blokken": [
    {
      "type": "casus_context",
      "tekst": "Uitbater van een lokale supermarkt verbruikt zelf etenswaren die moeilijk verkoopbaar zijn (beschadigde verpakking of vervaldatum nadert). Hij gaat de producten zelf verbruiken in plaats van te verkopen met afslag of te vernietigen."
    }
  ],
  "vragen": [
    {
      "id": "a",
      "label_in_pdf": "–",
      "vraagtype": "mc_keuze",
      "vraagstelling": "Moet de winkelier de btw regelen?",
      "opties": [
        {
          "id": "a",
          "tekst": "Neen, eigen verbruik van vervallen producten is toegelaten."
        },
        {
          "id": "b",
          "tekst": "Ja, hij moet een stuk opmaken aan zichzelf en de btw voldoen op de verkoopprijs van de producten die hij onttrekt uit zijn voorraad."
        },
        {
          "id": "c",
          "tekst": "Ja, hij moet een stuk opmaken aan zichzelf en de btw voldoen op een verminderde waarde, namelijk de aankoopprijs van de goederen op het moment van de onttrekking en rekening houdend met de staat waarin ze zich bevinden."
        },
        {
          "id": "d",
          "tekst": "Ja, hij moet de btw die hij oorspronkelijk op de aankoop van de producten heeft afgetrokken terugstorten via een herziening."
        },
        {
          "id": "e",
          "tekst": "Neen, dit is geen handeling onder bezwarende titel, want hij betaalt niet voor het onttrekken van de producten."
        }
      ],
      "motivatie_verwacht": false,
      "volledigheid": "volledig"
    }
  ],
  "antwoord_hint_in_vraag": null,
  "herinterpretatie_motivering": "Vraag 3 van de sectie 'BTW'. Enkelvoudige MC-vraag met 5 opties.",
  "kwaliteits_flags": []
}