{
  "schema_versie": "1.2",
  "examen_id": "2024-1",
  "vraag_id": "2024-1-vr7",
  "interpretatie_datum": "2026-05-21T00:00:00Z",
  "interpretatie_model": "claude-sonnet-4-6",
  "vraag_herkomst": "herinnering",
  "vraag_onderwerp": "IFRS — voorraadwaardering, voorzichtigheidsprincipe en vaste activa",
  "themas": [
    "IAS/IFRS",
    "voorraadwaardering",
    "FIFO",
    "LIFO",
    "gewogen gemiddelde",
    "voorzichtigheidsprincipe",
    "afschrijvingen",
    "leasing",
    "uitzonderlijke opbrengsten"
  ],
  "programmaonderdeel_ids": [
    "1.5"
  ],
  "context_blokken": [],
  "vragen": [
    {
      "id": "a1",
      "label_in_pdf": "A.1",
      "vraagtype": "juist_fout",
      "vraagstelling": "Onder IAS/IFRS zijn volgende methoden mogelijk: FIFO, LIFO, gewogen gemiddelde, individueel.",
      "motivatie_verwacht": false,
      "volledigheid": "volledig"
    },
    {
      "id": "a2",
      "label_in_pdf": "A.2",
      "vraagtype": "juist_fout",
      "vraagstelling": "Onder IAS/IFRS zijn volgende methoden mogelijk: FIFO, gewogen gemiddelde, individueel.",
      "motivatie_verwacht": false,
      "volledigheid": "volledig"
    },
    {
      "id": "a3",
      "label_in_pdf": "A.3",
      "vraagtype": "juist_fout",
      "vraagstelling": "Onder IAS/IFRS zijn volgende methoden mogelijk: LIFO, gewogen gemiddelde, individueel.",
      "motivatie_verwacht": false,
      "volledigheid": "volledig"
    },
    {
      "id": "a4",
      "label_in_pdf": "A.4",
      "vraagtype": "juist_fout",
      "vraagstelling": "Onder IAS/IFRS zijn volgende methoden mogelijk: FIFO en gewogen gemiddelde.",
      "motivatie_verwacht": false,
      "volledigheid": "volledig"
    },
    {
      "id": "b1",
      "label_in_pdf": "B.1",
      "vraagtype": "juist_fout",
      "vraagstelling": "Richtlijn 2013/34/EU, opname waardering volgens voorzichtigheidsprincipe: winsten mogen slechts opgenomen worden voor zover zij op balansdatum gerealiseerd zijn.",
      "motivatie_verwacht": false,
      "volledigheid": "volledig"
    },
    {
      "id": "b2",
      "label_in_pdf": "B.2",
      "vraagtype": "juist_fout",
      "vraagstelling": "Richtlijn 2013/34/EU, opname waardering volgens voorzichtigheidsprincipe: verplichtingen die hun oorsprong hebben in het betrokken boekjaar of in de loop van een vorig boekjaar worden opgenomen, ook als die verplichting pas wordt bekend tussen balansdatum en de datum waarop de balans wordt opgesteld.",
      "motivatie_verwacht": false,
      "volledigheid": "volledig"
    },
    {
      "id": "b3",
      "label_in_pdf": "B.3",
      "vraagtype": "juist_fout",
      "vraagstelling": "Richtlijn 2013/34/EU, opname waardering volgens voorzichtigheidsprincipe: alle negatieve waardecorrecties worden opgenomen ongeacht of het boekjaar met winst of verlies wordt afgesloten.",
      "motivatie_verwacht": false,
      "volledigheid": "volledig"
    },
    {
      "id": "b4",
      "label_in_pdf": "B.4",
      "vraagtype": "juist_fout",
      "vraagstelling": "Richtlijn 2013/34/EU, opname waardering volgens voorzichtigheidsprincipe: voor bepaalde categorieën van ondernemingen wordt verplicht om bepaalde vaste activa aan geherwaardeerde waarde op te nemen.",
      "motivatie_verwacht": false,
      "volledigheid": "volledig"
    },
    {
      "id": "c1",
      "label_in_pdf": "C.1",
      "vraagtype": "juist_fout",
      "vraagstelling": "Onder IAS/IFRS zijn degressieve afschrijvingen toegestaan.",
      "motivatie_verwacht": false,
      "volledigheid": "volledig"
    },
    {
      "id": "c2",
      "label_in_pdf": "C.2",
      "vraagtype": "juist_fout",
      "vraagstelling": "Kosten voor voorbereiding van een terrein……?",
      "motivatie_verwacht": false,
      "volledigheid": "fragment"
    },
    {
      "id": "c3",
      "label_in_pdf": "C.3",
      "vraagtype": "juist_fout",
      "vraagstelling": "Onder IAS/IFRS is het boeken van uitzonderlijke opbrengsten toegestaan.",
      "motivatie_verwacht": false,
      "volledigheid": "volledig"
    },
    {
      "id": "c4",
      "label_in_pdf": "C.4",
      "vraagtype": "juist_fout",
      "vraagstelling": "Afschrijving op materiële vaste activa mag stopgezet worden wanneer de reële waarde van het actief groter is dan de boekwaarde.",
      "motivatie_verwacht": false,
      "volledigheid": "volledig"
    },
    {
      "id": "d",
      "label_in_pdf": "D",
      "vraagtype": "open",
      "vraagstelling": "Hoe behandelen: operationele / financiële leasing?",
      "motivatie_verwacht": false,
      "volledigheid": "volledig"
    }
  ],
  "antwoord_hint_in_vraag": null,
  "herinterpretatie_motivering": "Herinnering-stijl 2024-1. Deelvraag A bevat 4 mc-stijl opties maar de vraag is 'juist/fout' per methode-combinatie — gemodelleerd als 4 juist/fout-deelvragen a1–a4. Deelvraag B bevat 4 stellingen over voorzichtigheidsprincipe (b1–b4). Deelvraag C bevat 4 stellingen over IAS/IFRS (c1–c4); c2 is fragment: de stelling over terrainskosten is onvolledig ('……?'). Typo 'Fifi' in tekst.txt gecorrigeerd naar 'FIFO' (optie A.2). Typo 'laesing' gecorrigeerd naar 'leasing' in D. 'VA' uitgeschreven als 'vaste activa'.",
  "kwaliteits_flags": [
    "typo_genormaliseerd"
  ]
}